Session,Paper,Title,LongVideo,Author 1,Affiliation 1,Author 2,Affiliation 2
T,1,Commercial Insurance Case Studies: Client Scenarios to Synthesize Topics and Solve Problems,,Harold Weston,Georgia State University,,
T,2,Modelling natural catastrophe risks and optimising risk transfer decisions: realistic approach for risk managers of oil and gas companies,,Derek Thrumble,Alesco Risk Management Services & Glasgow Caledonian University,Madhu Acharyya,Glasgow Caledonian University
T,3,Capital and Catastrophes: A Dungeons and Dragons-inspired Insurance Market Simulation,,James Hilliard,Temple University,,
T,4,Reinsurance Contract Structuring and Securitisation of Insurance Risk – an Exercise,,Stanley Mutenga,Starz Risk Solutions Limited & Glasgow Caledonian University,Madhu Acharyya,Glasgow Caledonian University
T,5,Video Assignments as Tools for Active Learning in Risk Management Courses,,Katja Hanewald,University of New South Wales ,,
T,6,Student Impressions of Online Learning,,Daniel Brown,University of Georgia ,,
T,7,MSc Insurance and Sustainable Risk Management,,Madhu Acharyya,Glasgow Caledonian University,,
